{
  "$schema": "https://json-schema.org/draft/2020-12/schema",
  "title": "DR-0125 one current reusable publication submission",
  "type": "object",
  "additionalProperties": false,
  "required": ["package","decision","status","runtimeActivation","coordinationTarget","requestVersion","responseVersion","coordinationMaximumRequestBytes","coordinationMaximumResponseBytes","contactMaximumSuccessBytes","requestHeaderBytes","requestFixedOverheadBytes","originalRequestMinimumBytes","originalRequestMaximumBytes","requestMinimumBytes","requestMaximumBytes","requestFieldBytes","requestSigningDomain","gatewayShardDomain","maximumCurrentSeconds","responseOverheadBytes","responseMinimumBytes","responseMaximumBytes","endpoint","requestMediaType","responseMediaType","responseValue","approvalTime","mutationIdentity","privateJournalChange","retiredCoordinationTargets","strictOneTimeCoordinationTarget"],
  "properties": {
    "package": {"const":"CONTACT-PUBLICATION-CURRENT-01"},
    "decision": {"const":"DR-0125"},
    "status": {"const":"FROZEN_TARGET_NOT_ACTIVE"},
    "runtimeActivation": {"const":false},
    "coordinationTarget": {"const":5},
    "requestVersion": {"const":1},
    "responseVersion": {"const":1},
    "coordinationMaximumRequestBytes": {"const":171870},
    "coordinationMaximumResponseBytes": {"const":96469},
    "contactMaximumSuccessBytes": {"const":131072},
    "requestHeaderBytes": {"const":8},
    "requestFixedOverheadBytes": {"const":244},
    "originalRequestMinimumBytes": {"const":23322},
    "originalRequestMaximumBytes": {"const":171614},
    "requestMinimumBytes": {"const":23566},
    "requestMaximumBytes": {"const":171858},
    "requestFieldBytes": {"const":[16,32,32,8,32,32,8,8,"LP32 exact signed V4 original intent",64]},
    "requestSigningDomain": {"const":"Deep/ContactResolver/V2/publication-current-request"},
    "gatewayShardDomain": {"const":"Deep/ContactResolver/V2/publication-current-gateway"},
    "maximumCurrentSeconds": {"const":120},
    "responseOverheadBytes": {"const":60},
    "responseMinimumBytes": {"const":15167},
    "responseMaximumBytes": {"const":96457},
    "endpoint": {"const":"/api/v2/contact-publication-current"},
    "requestMediaType": {"const":"application/vnd.deep.contact-publication-current-request.v1+octet-stream"},
    "responseMediaType": {"const":"application/vnd.deep.contact-publication-current-response.v1+octet-stream"},
    "responseValue": {"const":"exact XPL1 with original XPU and current submission nonce/window/view"},
    "approvalTime": {"const":"actual current approval and issuing head; independent of immutable original body window; never backdated"},
    "mutationIdentity": {"const":"original XPU request hash, operation, generation, ciphertext and node receipt tuple"},
    "privateJournalChange": {"const":false},
    "retiredCoordinationTargets": {"const":[3,4]},
    "strictOneTimeCoordinationTarget": {"const":2}
  }
}
