{
  "package": "CONTACT-PUBLICATION-CURRENT-01",
  "decision": "DR-0125",
  "status": "FROZEN_TARGET_NOT_ACTIVE",
  "runtimeActivation": false,
  "coordinationTarget": 5,
  "requestVersion": 1,
  "responseVersion": 1,
  "coordinationMaximumRequestBytes": 171870,
  "coordinationMaximumResponseBytes": 96469,
  "contactMaximumSuccessBytes": 131072,
  "requestHeaderBytes": 8,
  "requestFixedOverheadBytes": 244,
  "originalRequestMinimumBytes": 23322,
  "originalRequestMaximumBytes": 171614,
  "requestMinimumBytes": 23566,
  "requestMaximumBytes": 171858,
  "requestFieldBytes": [16,32,32,8,32,32,8,8,"LP32 exact signed V4 original intent",64],
  "requestSigningDomain": "Deep/ContactResolver/V2/publication-current-request",
  "gatewayShardDomain": "Deep/ContactResolver/V2/publication-current-gateway",
  "maximumCurrentSeconds": 120,
  "responseOverheadBytes": 60,
  "responseMinimumBytes": 15167,
  "responseMaximumBytes": 96457,
  "endpoint": "/api/v2/contact-publication-current",
  "requestMediaType": "application/vnd.deep.contact-publication-current-request.v1+octet-stream",
  "responseMediaType": "application/vnd.deep.contact-publication-current-response.v1+octet-stream",
  "responseValue": "exact XPL1 with original XPU and current submission nonce/window/view",
  "approvalTime": "actual current approval and issuing head; independent of immutable original body window; never backdated",
  "mutationIdentity": "original XPU request hash, operation, generation, ciphertext and node receipt tuple",
  "privateJournalChange": false,
  "retiredCoordinationTargets": [3,4],
  "strictOneTimeCoordinationTarget": 2
}
